{
  "schema_version": "model_tier_router_advisory_request_v1alpha1",
  "request_id": "text-tools-example",
  "requirements": {
    "modalities": ["text"],
    "tool_support": true,
    "maximum_cost_class": "medium"
  },
  "preferences": ["higher_reasoning", "lower_latency"],
  "evidence": {
    "modalities": true,
    "tool_support": true
  }
}
